{
  "skill": "holohub_flow_benchmark",
  "input": {
    "fixture": "<repo>/skills/holohub-flow-benchmark/fixtures/default"
  },
  "environment": {
    "python_executable": "python3",
    "cuda_visible_devices": null,
    "nvidia_visible_devices": null,
    "display": null,
    "display_configured": false
  },
  "plan": {
    "app": "endoscopy_tool_tracking",
    "language": "python",
    "schedulers": [
      "greedy"
    ],
    "runs": 1,
    "instances": 1,
    "messages": 100,
    "worker_threads": 1,
    "monitor_gpu": true,
    "run_mode": "local",
    "skip_begin_messages": 10,
    "discard_last_messages": 10,
    "build_requested": false,
    "no_docker_build": false,
    "clean_output": true,
    "mode": "verify",
    "smoke_mode": false,
    "rationale": [
      "run HoloHub benchmarking inside the HoloHub container by default",
      "delegate instrumentation to HoloHub holoscan_flow_benchmarking",
      "parse host-visible data-flow tracking logs into evidence-pack latency metrics"
    ]
  },
  "invocation": {
    "holohub_root": "<stub_holohub_root>",
    "holohub_commit": "73efd0b8653b4ccc6f62af44932e3dfd8dadfff6",
    "benchmark_script": "<stub_holohub_root>/benchmarks/holoscan_flow_benchmarking/benchmark.py",
    "output_dir": "<repo>/verifiers/holohub_flow_benchmark_quality_v1/fixtures/pass_pack/artifacts/flow_benchmark_output",
    "container_output_dir": "/workspace/volumes/flow_benchmark_output",
    "run_mode": "local",
    "container_workspace": "holohub",
    "container_command": null,
    "container_exit_code": null,
    "build_command": null,
    "build_exit_code": null,
    "benchmark_command": [
      "python3",
      "<stub_holohub_root>/benchmarks/holoscan_flow_benchmarking/benchmark.py",
      "-a",
      "endoscopy_tool_tracking",
      "--language",
      "python",
      "-r",
      "1",
      "-i",
      "1",
      "-m",
      "100",
      "-d",
      "<repo>/verifiers/holohub_flow_benchmark_quality_v1/fixtures/pass_pack/artifacts/flow_benchmark_output",
      "--sched",
      "greedy",
      "-u"
    ],
    "benchmark_exit_code": 0,
    "custom_run_command": null,
    "gpu": "all",
    "container_image": "holohub-endoscopy_tool_tracking:main",
    "container_image_id": "sha256:35221ba8dfdad1605b23ba639d2ed88a4d5382c8e4512aa3d1d1a5e5c69edad9",
    "model_path": "<stub_holohub_root>/data/endoscopy/tool_loc_convlstm.onnx",
    "model_sha256": "229e6db7859964b62c1c836b4d2aa94c9d97a916295da7048657d4127d467698"
  },
  "output": {
    "logger": {
      "count": 1,
      "total_bytes": 37300,
      "files": [
        {
          "path": "logger_greedy_1_1.log",
          "bytes": 37300,
          "sha256": "8f753769ad4347feae94eb352af985c37dbba949008db417ac9a3f1cf61f7862"
        }
      ]
    },
    "gpu_utilization": {
      "count": 1,
      "total_bytes": 10,
      "files": [
        {
          "path": "gpu_utilization_greedy_1.csv",
          "bytes": 10,
          "sha256": "cb240acdfc2e0b1df311ae1c68f314fdc834d382779e5f4e6ce7f0d7dc8a160e"
        }
      ]
    },
    "other": {
      "count": 1,
      "total_bytes": 50,
      "files": [
        {
          "path": "benchmark.log",
          "bytes": 50,
          "sha256": "3095add801b8f784599abf27e169923e011b07349b5aef75bf577f4ad2140c5f"
        }
      ]
    }
  },
  "analysis": {
    "skip_begin_messages": 10,
    "discard_last_messages": 10,
    "schedulers": {
      "greedy": {
        "path_count": 2,
        "paths": {
          "Endoscopy App.replayer -> Endoscopy App.format_converter -> Endoscopy App.lstm_inferer -> Endoscopy App.tool_tracking_postprocessor -> Endoscopy App.holoviz": {
            "sample_count": 80,
            "min_ms": 12.0,
            "avg_ms": 12.0,
            "median_ms": 12.0,
            "max_ms": 12.0,
            "p95_ms": 12.0,
            "p99_ms": 12.0,
            "tail_95_100_ms": 0.0,
            "flatness_10_90_ms": 0.0
          },
          "Endoscopy App.replayer -> Endoscopy App.holoviz": {
            "sample_count": 80,
            "min_ms": 12.0,
            "avg_ms": 12.0,
            "median_ms": 12.0,
            "max_ms": 12.0,
            "p95_ms": 12.0,
            "p99_ms": 12.0,
            "tail_95_100_ms": 0.0,
            "flatness_10_90_ms": 0.0
          }
        }
      }
    },
    "paths_observed": 2,
    "total_latency_samples": 160,
    "first_path": {
      "scheduler": "greedy",
      "path": "Endoscopy App.replayer -> Endoscopy App.format_converter -> Endoscopy App.lstm_inferer -> Endoscopy App.tool_tracking_postprocessor -> Endoscopy App.holoviz",
      "sample_count": 80,
      "min_ms": 12.0,
      "avg_ms": 12.0,
      "median_ms": 12.0,
      "max_ms": 12.0,
      "p95_ms": 12.0,
      "p99_ms": 12.0,
      "tail_95_100_ms": 0.0,
      "flatness_10_90_ms": 0.0
    },
    "gpu_utilization": {
      "sample_count": 3,
      "avg_percent": 30.0,
      "max_percent": 40.0
    }
  },
  "domain": {
    "app": "endoscopy_tool_tracking",
    "expected_logger_count": 1,
    "observed_logger_count": 1,
    "logger_count_matches_plan": true,
    "requested_schedulers": [
      "greedy"
    ],
    "observed_schedulers": [
      "greedy"
    ],
    "scheduler_coverage_complete": true,
    "paths_with_samples": 2,
    "expected_effective_samples_per_path": 80,
    "min_path_sample_count": 80,
    "sample_count_matches_messages": true,
    "benchmark_log": {
      "present": true,
      "evaluation_completed": true,
      "missing_log_errors": false,
      "mentions_app": true
    }
  },
  "contract": {
    "present": true,
    "path": "<repo>/skills/holohub-flow-benchmark/contracts/endoscopy_tool_tracking.yaml",
    "error": "",
    "app": "endoscopy_tool_tracking",
    "notes": "Budgets assume the default container Holoviz render path. Adjust when\nrunning headless or with custom --run-args.\n",
    "observed_operators": [
      "Endoscopy App.format_converter",
      "Endoscopy App.holoviz",
      "Endoscopy App.lstm_inferer",
      "Endoscopy App.replayer",
      "Endoscopy App.tool_tracking_postprocessor"
    ],
    "scheduler_results": {
      "greedy": {
        "path_count": 2,
        "primary_path_present": true,
        "direct_paths_present": {
          "Endoscopy App.replayer -> Endoscopy App.holoviz": true
        },
        "all_direct_paths_present": true,
        "primary_path": "Endoscopy App.replayer -> Endoscopy App.format_converter -> Endoscopy App.lstm_inferer -> Endoscopy App.tool_tracking_postprocessor -> Endoscopy App.holoviz",
        "sample_count": 80,
        "avg_ms": 12.0,
        "median_ms": 12.0,
        "p95_ms": 12.0,
        "p99_ms": 12.0,
        "tail_95_100_ms": 0.0,
        "flatness_10_90_ms": 0.0,
        "min_ms": 12.0,
        "max_ms": 12.0
      }
    },
    "required_data_files": [
      {
        "path": "data/endoscopy/tool_loc_convlstm.onnx",
        "exists": true,
        "bytes": 576,
        "sha256": "229e6db7859964b62c1c836b4d2aa94c9d97a916295da7048657d4127d467698",
        "expected_sha256": null,
        "sha256_matches": true
      },
      {
        "path": "data/endoscopy/surgical_video.gxf_entities",
        "exists": true,
        "bytes": 832,
        "sha256": "efc475a9912a48f3d08032ceac578b4ecaca502c3cb9865d72baf26184e6a54b",
        "expected_sha256": null,
        "sha256_matches": true
      },
      {
        "path": "data/endoscopy/surgical_video.gxf_index",
        "exists": true,
        "bytes": 640,
        "sha256": "63fbb3abd9c448a35a92220f57446a6dfde8d47cfbd95ccf871c673a9b88a230",
        "expected_sha256": null,
        "sha256_matches": true
      }
    ],
    "latency_budget_results": {
      "greedy": {
        "p50_ms_max": true,
        "p95_ms_max": true,
        "p99_ms_max": true,
        "tail_95_100_ms_max": true,
        "flatness_10_90_ms_max": true,
        "min_sample_count": true
      }
    },
    "assertions": {
      "contract_loaded": true,
      "app_matches_contract": true,
      "source_file_present": true,
      "required_data_files_present": true,
      "required_data_files_hash_match": true,
      "scheduler_coverage_complete": true,
      "primary_sequence_present": true,
      "direct_paths_present": true,
      "latency_budgets_met": true,
      "smoke_mode_skipped_budgets": false,
      "all_required_assertions_passed": true
    },
    "source_file": "applications/endoscopy_tool_tracking/python/endoscopy_tool_tracking.py",
    "source_file_present": true,
    "model_file": "data/endoscopy/tool_loc_convlstm.onnx",
    "model_sha256": "229e6db7859964b62c1c836b4d2aa94c9d97a916295da7048657d4127d467698",
    "target_hardware": [
      {
        "line": "edge_clinical",
        "sku": "IGX_AGX_Orin"
      },
      {
        "line": "workstation",
        "sku": "RTX_6000_Ada"
      }
    ],
    "calibration_hardware": "RTX_6000_Ada",
    "flow_assertions": {
      "primary_sequence": [
        "Endoscopy App.replayer",
        "Endoscopy App.format_converter",
        "Endoscopy App.lstm_inferer",
        "Endoscopy App.tool_tracking_postprocessor",
        "Endoscopy App.holoviz"
      ],
      "direct_paths": [
        [
          "Endoscopy App.replayer",
          "Endoscopy App.holoviz"
        ]
      ]
    },
    "latency_budgets": {
      "p50_ms_max": null,
      "p95_ms_max": 38.0,
      "p99_ms_max": 50.0,
      "tail_95_100_ms_max": null,
      "flatness_10_90_ms_max": null,
      "min_sample_count": 80
    },
    "smoke_mode": false
  },
  "runtime": {
    "build_seconds": null,
    "benchmark_seconds": 1.0698008549952647,
    "container_seconds": null,
    "total_seconds": 1.0698008549952647
  },
  "logs": {
    "build_stdout_tail": "",
    "build_stderr_tail": "",
    "container_stdout_tail": "",
    "container_stderr_tail": "",
    "benchmark_stdout_tail": "stub benchmark complete\n",
    "benchmark_stderr_tail": ""
  },